55939a0315522ed4b3e326c9	FreeCodeCamp/Taipei	2016-09-17T11:02:16.533Z	540a150e163965c9bc202eaf	abhisekp	57dd22b8c8af41d45f21fe67	"-----

-----

-----
## This room will be closed and archived.
** @/all Please move discussion of this topic to our forum, or to one of the official Free Code Camp chat rooms: http://forum.freecodecamp.com/t/free-code-camp-official-chat-rooms/19390**

-----

-----

-----"
55939a0315522ed4b3e326c9	FreeCodeCamp/Taipei	2016-08-25T10:42:14.674Z	57b4333740f3a6eec05fe8e5	kaiying	57becb865bdd197c1cbd3f06	大家好我是新加入的夥伴~
55939a0315522ed4b3e326c9	FreeCodeCamp/Taipei	2016-07-20T06:55:11.802Z	56a8cd61e610378809be756c	axel8591	578f204f9f35137e67e439c5	Hi everybody!
55939a0315522ed4b3e326c9	FreeCodeCamp/Taipei	2016-06-29T07:32:20.028Z	57737932c2f0db084a2080e8	HanakoHung	577379848c9263ba30260a97	Hello World! I'm Hana.
55939a0315522ed4b3e326c9	FreeCodeCamp/Taipei	2016-05-17T09:05:28.437Z	55947a8c15522ed4b3e333ce	Corraker	573aded80cb634927f7f8e34	@Beltayn Thank you I just did join see you around
55939a0315522ed4b3e326c9	FreeCodeCamp/Taipei	2016-05-17T05:06:43.085Z	559c0bda15522ed4b3e39455	Beltayn	573aa6e364dbdadc7decb193	@Corraker  Hey man, come join our Facebook community.  That's where you'll find everyone.  https://www.facebook.com/groups/free.code.camp.taipei/
55939a0315522ed4b3e326c9	FreeCodeCamp/Taipei	2016-05-12T18:30:33.995Z	55947a8c15522ed4b3e333ce	Corraker	5734cbc9e2996a5a42c7d2a0	whole
55939a0315522ed4b3e326c9	FreeCodeCamp/Taipei	2016-05-12T18:28:52.839Z	55947a8c15522ed4b3e333ce	Corraker	5734cb640cb634927f7e4d60	btw I will start the hole process this week, if someone is about to start or just started a few coding hours ago we could get together to work and enjoy the process even more, 
55939a0315522ed4b3e326c9	FreeCodeCamp/Taipei	2016-05-12T18:16:47.193Z	55947a8c15522ed4b3e333ce	Corraker	5734c88fc61823687d3b4c3b	Well I finally did it… I am living in Taipei…. hope to get to know guys !
55939a0315522ed4b3e326c9	FreeCodeCamp/Taipei	2015-11-07T06:49:28.305Z	563d9e5f16b6c7089cb9cd29	DomaLu	563d9ef82e8c19094ec07176	hello world!
55939a0315522ed4b3e326c9	FreeCodeCamp/Taipei	2015-11-07T06:48:01.663Z	56062f710fc9f982beb1e53a	soap1069	563d9ea1c712fe074e4e2ec0	http://codepen.io/perrot/pen/XmEzXG?editors=101
55939a0315522ed4b3e326c9	FreeCodeCamp/Taipei	2015-11-07T06:47:56.362Z	56062f710fc9f982beb1e53a	soap1069	563d9e9cc712fe074e4e2ebf	hhello
55939a0315522ed4b3e326c9	FreeCodeCamp/Taipei	2015-10-10T07:05:13.253Z	559c0bda15522ed4b3e39455	Beltayn	5618b8a983b69fe7548d5739	http://www.videograbby.com/
55939a0315522ed4b3e326c9	FreeCodeCamp/Taipei	2015-10-10T06:57:04.943Z	559c0bda15522ed4b3e39455	Beltayn	5618b6c06dc64436714aa3c1	This is what Sophia mentioned: http://collabfinder.com/
55939a0315522ed4b3e326c9	FreeCodeCamp/Taipei	2015-10-10T06:35:58.075Z	559c0bda15522ed4b3e39455	Beltayn	5618b1ce83b69fe7548d56c0	Anyone here for coffee-and-code,  I'll paste any links here that I talk about,
55939a0315522ed4b3e326c9	FreeCodeCamp/Taipei	2015-10-06T21:41:34.435Z	546fc9f1db8155e6700d6e8c	QuincyLarson	5614400efd5c74d714142e67	"##Please note that we now recommend campers use their Campsite’s Facebook group for chatting instead of their campsite’s Gitter chatroom. 
We are doing this because few of our Campsite Gitter chatroooms have active synchronous discussions, and about 1/3rd of conversations consist of someone saying “hello” and not getting a response. Most of the discussions are asynchronous, which Facebook posts and group messages are better suited for.
We’ve removed this Gitter room from our Campsite directory. Still, we will keep it open for archival purposes, and you can keep using it if you’d like.
Here’s a short blog post about how our Campsites are evolving and growing: http://blog.freecodecamp.com/2015/09/jump-start-your-local-campsite-with-coffee-and-code.html"
55939a0315522ed4b3e326c9	FreeCodeCamp/Taipei	2015-09-30T07:25:49.611Z	56062f710fc9f982beb1e53a	soap1069	560b8e7df4b61c106fb2bde9	im very much in :) 
55939a0315522ed4b3e326c9	FreeCodeCamp/Taipei	2015-09-30T05:07:05.590Z	559c0bda15522ed4b3e39455	Beltayn	560b6df9ff22c70f6fab4ba0	Ok, great I see you checked in on the FB page. See you there.
55939a0315522ed4b3e326c9	FreeCodeCamp/Taipei	2015-09-30T05:04:49.004Z	5607bfa80fc9f982beb1f941	jeffreychao	560b6d71dfb3151302857384	@Beltayn Sure! Why not? ;) put me down for one
55939a0315522ed4b3e326c9	FreeCodeCamp/Taipei	2015-09-30T02:33:26.321Z	559c0bda15522ed4b3e39455	Beltayn	560b49f695756f1402bc93e9	@wang048  @jeffreychao  @soap1069  You guys in?  I'll put something on Facebook too.
55939a0315522ed4b3e326c9	FreeCodeCamp/Taipei	2015-09-30T02:32:57.559Z	559c0bda15522ed4b3e39455	Beltayn	560b49d9552ed7913279eccc	I just saw Quincy's post. Let's do this. Let's meet up this Saturday (10/3) afternoon. There are loads of little coffee shops around the Taipower builing/Gongguan area. Who's in?
55939a0315522ed4b3e326c9	FreeCodeCamp/Taipei	2015-09-27T13:11:06.451Z	56062f710fc9f982beb1e53a	soap1069	5607eaeaefd97f3e4669ad3a	Coding should not be a lonely journey...
55939a0315522ed4b3e326c9	FreeCodeCamp/Taipei	2015-09-27T13:10:53.233Z	56062f710fc9f982beb1e53a	soap1069	5607eadd8e1f583b467445d9	I just joined too! I'm a newbie and down for coffee!! 
55939a0315522ed4b3e326c9	FreeCodeCamp/Taipei	2015-09-27T11:36:55.164Z	5607bfa80fc9f982beb1f941	jeffreychao	5607d4d72652445532ce63a3	"hey @Beltayn thanks!
I did request to join the group, pending the approval of request! lol
Haha well Taipei is indeed in Taiwan, so no confusion there :P"
55939a0315522ed4b3e326c9	FreeCodeCamp/Taipei	2015-09-27T11:16:19.784Z	559c0bda15522ed4b3e39455	Beltayn	5607d003696b13767a90af0a	Gah, I meant you're in Taipei, not Taiwan.
55939a0315522ed4b3e326c9	FreeCodeCamp/Taipei	2015-09-27T11:16:02.811Z	559c0bda15522ed4b3e39455	Beltayn	5607cff22652445532ce635d	Looks like you're in Taiwan. Join our facebook group if you can and we should all try and meet up some time for drinks.
55939a0315522ed4b3e326c9	FreeCodeCamp/Taipei	2015-09-27T11:15:34.417Z	559c0bda15522ed4b3e39455	Beltayn	5607cfd68e1f583b46744496	Hey Jeffrey, welcome.
55939a0315522ed4b3e326c9	FreeCodeCamp/Taipei	2015-09-27T10:30:19.060Z	5607bfa80fc9f982beb1f941	jeffreychao	5607c53b8e1f583b46744411	hope to meet some other coders sometime :sparkles: 
55939a0315522ed4b3e326c9	FreeCodeCamp/Taipei	2015-09-27T10:29:50.633Z	5607bfa80fc9f982beb1f941	jeffreychao	5607c51eb25b32533216e5cd	:)
55939a0315522ed4b3e326c9	FreeCodeCamp/Taipei	2015-09-27T10:29:48.489Z	5607bfa80fc9f982beb1f941	jeffreychao	5607c51c2652445532ce62e4	so far the experience is amazing!
55939a0315522ed4b3e326c9	FreeCodeCamp/Taipei	2015-09-27T10:29:35.689Z	5607bfa80fc9f982beb1f941	jeffreychao	5607c50f2652445532ce62e3	one of my friend told me about this amazing site to learn coding
55939a0315522ed4b3e326c9	FreeCodeCamp/Taipei	2015-09-27T10:29:02.647Z	5607bfa80fc9f982beb1f941	jeffreychao	5607c4ee2652445532ce62e2	hey everyone. newbie here :smile: 
55939a0315522ed4b3e326c9	FreeCodeCamp/Taipei	2015-09-15T02:42:45.321Z	55f784260fc9f982beb0b1b8	wang048	55f785a518e0111d7e4eddb0	Google~~haha
55939a0315522ed4b3e326c9	FreeCodeCamp/Taipei	2015-09-09T04:08:48.204Z	559c0bda15522ed4b3e39455	Beltayn	55efb0d0760979e727e93716	Hi and welcome festime. Feel free to join our Facebook group for Taipei. I put a post up there to meet up but so far only one person responded. Let us know if you're up for coffee some time.
55939a0315522ed4b3e326c9	FreeCodeCamp/Taipei	2015-09-08T04:14:31.430Z	55ee5e7e0fc9f982beaff7af	festime	55ee60a7f86e90e11d5d9172	"Hello, everyone, I found FreeCodeCamp in a quota post written by Larson. I have learned Rails for several months. I built a website for my university classmates. But the UI is not very well. So I decided to learn some front-end basics.

FreeCodeCamp is very cool! I believe I will enjoy it. :smile:"
55939a0315522ed4b3e326c9	FreeCodeCamp/Taipei	2015-09-02T03:59:20.452Z	559c0bda15522ed4b3e39455	Beltayn	55e674180c2952401fb80313	Welp, guess that counts you out till next year then :D
55939a0315522ed4b3e326c9	FreeCodeCamp/Taipei	2015-09-02T03:58:58.377Z	55947a8c15522ed4b3e333ce	Corraker	55e674020c2952401fb80312	:( I am in Latin America until next year 
55939a0315522ed4b3e326c9	FreeCodeCamp/Taipei	2015-09-02T03:56:45.400Z	559c0bda15522ed4b3e39455	Beltayn	55e6737df0248505272d9368	"Hey all. I made a post in the Free Code Camp Taipei Facebook page asking if anyone wants to meet up face to face sometime. If you're not on the Facebook group, here's the link: https://www.facebook.com/groups/free.code.camp.taipei/

I'd love to meet other people in Taipei who are also learning to code."
55939a0315522ed4b3e326c9	FreeCodeCamp/Taipei	2015-08-31T15:49:58.134Z	559c0bda15522ed4b3e39455	Beltayn	55e477a670e051b716389f92	So what's everyone working on?
55939a0315522ed4b3e326c9	FreeCodeCamp/Taipei	2015-08-31T15:48:23.584Z	559c0bda15522ed4b3e39455	Beltayn	55e4774770e051b716389f83	Hey Chad, welcome. 
55939a0315522ed4b3e326c9	FreeCodeCamp/Taipei	2015-08-30T04:31:01.334Z	55e1dc990fc9f982beaf01e8	ChadCYB	55e287056d5732de5b7714f1	Hi All~~
55939a0315522ed4b3e326c9	FreeCodeCamp/Taipei	2015-08-16T11:57:32.541Z	55c0381b0fc9f982beac17af	iamjoycelee	55d07aac3d8917890c1640d3	"Haha, just search ""Free coding learning""  ,and it shows up  lol"
55939a0315522ed4b3e326c9	FreeCodeCamp/Taipei	2015-08-15T05:07:32.076Z	559c0bda15522ed4b3e39455	Beltayn	55cec9149b45e15c42644d0b	Pretty quiet in here. How'd you guys find FCC?
55939a0315522ed4b3e326c9	FreeCodeCamp/Taipei	2015-08-15T05:05:39.568Z	559c0bda15522ed4b3e39455	Beltayn	55cec8a3255950880cfb9929	Hey guys. Welcome.
55939a0315522ed4b3e326c9	FreeCodeCamp/Taipei	2015-08-14T01:17:46.724Z	55cbfa240fc9f982bead366c	vicjht	55cd41ba057d8c9d3a6d47aa	Hello World ^^
55939a0315522ed4b3e326c9	FreeCodeCamp/Taipei	2015-08-13T19:10:36.462Z	55cce45b0fc9f982bead4b86	Rafael-Lin	55ccebac255950880cfb619e	Hello word :smile: 
55939a0315522ed4b3e326c9	FreeCodeCamp/Taipei	2015-07-19T10:41:47.996Z	559c0bda15522ed4b3e39455	Beltayn	55ab7eeb1b12d231470065aa	@mikachen Hi mika and welcome. I've been coding for a long time but never professionally. I'm through all of the FCC stuff up to RegEx. If you need help with anything feel free to ask.
55939a0315522ed4b3e326c9	FreeCodeCamp/Taipei	2015-07-17T14:47:35.142Z	55947a8c15522ed4b3e333ce	Corraker	55a91587c699376a75659c23	hello. good for you. Actually I am moving back to Taipei just to study at the university.  Do you recommend any? 
55939a0315522ed4b3e326c9	FreeCodeCamp/Taipei	2015-07-17T14:43:32.812Z	5596213d15522ed4b3e34a58	mikachen	55a9149432802c7f520363d7	"Hello everyone! my name is Mika and just graduated from university last month.
I'm a novice at coding . Nice to meet you guys ^_^"
55939a0315522ed4b3e326c9	FreeCodeCamp/Taipei	2015-07-13T12:26:33.443Z	559c0bda15522ed4b3e39455	Beltayn	55a3ae798e28b0c71ac964d8	Ok let me know any time.
55939a0315522ed4b3e326c9	FreeCodeCamp/Taipei	2015-07-13T05:20:44.910Z	55a344035e0d51bd787b311e	falgoust	55a34aace265db741cabecb1	Hi ! I live in New Taipei City. I just started learning programming and talk to you more in the future.
55939a0315522ed4b3e326c9	FreeCodeCamp/Taipei	2015-07-08T16:08:27.807Z	55947a8c15522ed4b3e333ce	Corraker	559d4afbecde9fb94915a118	No in my case I will arrive taipei until next year... 
55939a0315522ed4b3e326c9	FreeCodeCamp/Taipei	2015-07-08T16:00:07.567Z	559c0bda15522ed4b3e39455	Beltayn	559d49071c1634674f8a95ac	Do you guys meet up anywhere?
55939a0315522ed4b3e326c9	FreeCodeCamp/Taipei	2015-07-08T16:00:01.291Z	559c0bda15522ed4b3e39455	Beltayn	559d490152cc8c664f51278b	@Corraker  Thanks man. 
55939a0315522ed4b3e326c9	FreeCodeCamp/Taipei	2015-07-08T15:56:40.757Z	55947a8c15522ed4b3e333ce	Corraker	559d48385331f9985a7feabb	Goodluck pal!  And hello
55939a0315522ed4b3e326c9	FreeCodeCamp/Taipei	2015-07-08T15:43:41.659Z	559c0bda15522ed4b3e39455	Beltayn	559d452d21e1d6761f2a3617	Heya all. I'm in Taipei. Not new to programming but my knowledge is kind of scattered all over the place. Hoping to finish FCC with a more usable skillset.
55939a0315522ed4b3e326c9	FreeCodeCamp/Taipei	2015-07-02T16:27:42.156Z	55947a8c15522ed4b3e333ce	Corraker	5595667e3c7fae9e21b3176f	Hope you get that job you want. 
55939a0315522ed4b3e326c9	FreeCodeCamp/Taipei	2015-07-02T16:19:41.094Z	54ffce3615522ed4b3dd1772	jonathanfb	5595649db634f09d21d98029	Thanks, for the advice. I will make sure I do that 
55939a0315522ed4b3e326c9	FreeCodeCamp/Taipei	2015-07-02T15:31:18.634Z	55947a8c15522ed4b3e333ce	Corraker	55955946b634f09d21d97e70	Exactly!  The more projects the better you will do at any interview. 
55939a0315522ed4b3e326c9	FreeCodeCamp/Taipei	2015-07-02T15:21:41.482Z	54ffce3615522ed4b3dd1772	jonathanfb	55955705fcbe8872682eba53	Alright, I guess I just have to keep coding and making projects. 
55939a0315522ed4b3e326c9	FreeCodeCamp/Taipei	2015-07-02T15:08:45.631Z	55947a8c15522ed4b3e333ce	Corraker	559553fd9132650b7390677e	I am taking the course because is an excellent way to develop a showcase without leaving my job as a content analyst 
55939a0315522ed4b3e326c9	FreeCodeCamp/Taipei	2015-07-02T15:07:46.774Z	55947a8c15522ed4b3e333ce	Corraker	559553c23c7fae9e21b31437	You will get the good jobs with the showcase of projects you can present and the part you did on each one of them
55939a0315522ed4b3e326c9	FreeCodeCamp/Taipei	2015-07-02T14:28:26.850Z	54ffce3615522ed4b3dd1772	jonathanfb	55954a8af1ed8771684fa3c9	Why are you taking the program?
55939a0315522ed4b3e326c9	FreeCodeCamp/Taipei	2015-07-02T14:28:05.215Z	54ffce3615522ed4b3dd1772	jonathanfb	55954a75fcbe8872682eb7bc	Nice. That may be true, but I do want the good jobs or at least the chance to get them. 
55939a0315522ed4b3e326c9	FreeCodeCamp/Taipei	2015-07-02T13:55:55.581Z	55947a8c15522ed4b3e333ce	Corraker	559542eb3c7fae9e21b310ef	JJ should be read as Js Javascript 
55939a0315522ed4b3e326c9	FreeCodeCamp/Taipei	2015-07-02T13:55:20.572Z	55947a8c15522ed4b3e333ce	Corraker	559542c8fcbe8872682eb68c	Cool! I am not in taipei right now but I will be next year. I think that if you finish this program and do the projects you won't need to go to a bootcamp except in the case of specializations like a JJ bootcamp or a. Net bootcamp.  I did research them for over a year (EEUU bootcamps) and they offer no much more than free bootcamp and the prices are ridiculously high.  
55939a0315522ed4b3e326c9	FreeCodeCamp/Taipei	2015-07-02T13:40:07.288Z	54ffce3615522ed4b3dd1772	jonathanfb	55953f37f1ed8771684fa202	Well let me introduce myself. My name is Jonathan. I am in Taichung. I have been learning how to computer program for over a year, but it's been more serious the last few months. I am a teacher in Taiwan and I teach my students programming as well, mostly khan academy and code.org. My goal is to attend a coding bootcamp after I finish this program and advance my skills, then get a job in the programming field. If anyone would like to chat and talk about programming or even just chat, send me a message. 你好我是喬納森。我現在住在台中。我一年多學電腦工程師。可是只有最近更認真學。如果想要談談請跟我聯絡。 
55939a0315522ed4b3e326c9	FreeCodeCamp/Taipei	2015-07-02T11:41:26.410Z	55947a8c15522ed4b3e333ce	Corraker	55952366b634f09d21d9755b	Hello 
55939a0315522ed4b3e326c9	FreeCodeCamp/Taipei	2015-07-02T08:32:08.864Z	558972d015522ed4b3e28103	shwbrent	5594f708b4ce4e473251216f	Hello 你好
55939a0315522ed4b3e326c9	FreeCodeCamp/Taipei	2015-07-02T06:11:45.194Z	54ffce3615522ed4b3dd1772	jonathanfb	5594d621b4ce4e4732511e5d	Hello world. 大家好
